{
  "schema_version": 1,
  "protocol": 1,
  "tested_host_commit": "f64c76dfa6e901fa6c1edb8e662554f378d33028",
  "plugins": [
    {
      "name": "sqlite",
      "repository": "https://github.com/l3aro/sqlite-driver-for-perk-workbench",
      "release_tag": "v0.1.0",
      "protocol": 1,
      "tested_ref": "f64c76dfa6e901fa6c1edb8e662554f378d33028",
      "targets": {
        "darwin/amd64": { "status": "pending", "asset_url": null, "asset_sha256": null, "target": { "goos": "darwin", "goarch": "amd64" }, "executable": "perk-sqlite", "executable_sha256": null },
        "darwin/arm64": { "status": "pending", "asset_url": null, "asset_sha256": null, "target": { "goos": "darwin", "goarch": "arm64" }, "executable": "perk-sqlite", "executable_sha256": null },
        "linux/amd64": { "status": "pending", "asset_url": null, "asset_sha256": null, "target": { "goos": "linux", "goarch": "amd64" }, "executable": "perk-sqlite", "executable_sha256": null },
        "linux/arm64": { "status": "pending", "asset_url": null, "asset_sha256": null, "target": { "goos": "linux", "goarch": "arm64" }, "executable": "perk-sqlite", "executable_sha256": null },
        "windows/amd64": { "status": "pending", "asset_url": null, "asset_sha256": null, "target": { "goos": "windows", "goarch": "amd64" }, "executable": "perk-sqlite.exe", "executable_sha256": null }
      }
    },
    {
      "name": "mysql",
      "repository": "https://github.com/l3aro/mysql-driver-for-perk-workbench",
      "release_tag": "v0.1.0",
      "protocol": 1,
      "tested_ref": "f64c76dfa6e901fa6c1edb8e662554f378d33028",
      "targets": {
        "darwin/amd64": { "status": "pending", "asset_url": null, "asset_sha256": null, "target": { "goos": "darwin", "goarch": "amd64" }, "executable": "perk-mysql", "executable_sha256": null },
        "darwin/arm64": { "status": "pending", "asset_url": null, "asset_sha256": null, "target": { "goos": "darwin", "goarch": "arm64" }, "executable": "perk-mysql", "executable_sha256": null },
        "linux/amd64": { "status": "pending", "asset_url": null, "asset_sha256": null, "target": { "goos": "linux", "goarch": "amd64" }, "executable": "perk-mysql", "executable_sha256": null },
        "linux/arm64": { "status": "pending", "asset_url": null, "asset_sha256": null, "target": { "goos": "linux", "goarch": "arm64" }, "executable": "perk-mysql", "executable_sha256": null },
        "windows/amd64": { "status": "pending", "asset_url": null, "asset_sha256": null, "target": { "goos": "windows", "goarch": "amd64" }, "executable": "perk-mysql.exe", "executable_sha256": null }
      }
    },
    {
      "name": "postgres",
      "repository": "https://github.com/l3aro/postgres-driver-for-perk-workbench",
      "release_tag": "v0.1.0",
      "protocol": 1,
      "tested_ref": "f64c76dfa6e901fa6c1edb8e662554f378d33028",
      "targets": {
        "darwin/amd64": { "status": "pending", "asset_url": null, "asset_sha256": null, "target": { "goos": "darwin", "goarch": "amd64" }, "executable": "perk-postgres", "executable_sha256": null },
        "darwin/arm64": { "status": "pending", "asset_url": null, "asset_sha256": null, "target": { "goos": "darwin", "goarch": "arm64" }, "executable": "perk-postgres", "executable_sha256": null },
        "linux/amd64": { "status": "pending", "asset_url": null, "asset_sha256": null, "target": { "goos": "linux", "goarch": "amd64" }, "executable": "perk-postgres", "executable_sha256": null },
        "linux/arm64": { "status": "pending", "asset_url": null, "asset_sha256": null, "target": { "goos": "linux", "goarch": "arm64" }, "executable": "perk-postgres", "executable_sha256": null },
        "windows/amd64": { "status": "pending", "asset_url": null, "asset_sha256": null, "target": { "goos": "windows", "goarch": "amd64" }, "executable": "perk-postgres.exe", "executable_sha256": null }
      }
    },
    {
      "name": "mongodb",
      "repository": "https://github.com/l3aro/mongodb-driver-for-perk-workbench",
      "release_tag": "v0.1.0",
      "protocol": 1,
      "tested_ref": "f64c76dfa6e901fa6c1edb8e662554f378d33028",
      "targets": {
        "darwin/amd64": { "status": "pending", "asset_url": null, "asset_sha256": null, "target": { "goos": "darwin", "goarch": "amd64" }, "executable": "perk-mongodb", "executable_sha256": null },
        "darwin/arm64": { "status": "pending", "asset_url": null, "asset_sha256": null, "target": { "goos": "darwin", "goarch": "arm64" }, "executable": "perk-mongodb", "executable_sha256": null },
        "linux/amd64": { "status": "pending", "asset_url": null, "asset_sha256": null, "target": { "goos": "linux", "goarch": "amd64" }, "executable": "perk-mongodb", "executable_sha256": null },
        "linux/arm64": { "status": "pending", "asset_url": null, "asset_sha256": null, "target": { "goos": "linux", "goarch": "arm64" }, "executable": "perk-mongodb", "executable_sha256": null },
        "windows/amd64": { "status": "pending", "asset_url": null, "asset_sha256": null, "target": { "goos": "windows", "goarch": "amd64" }, "executable": "perk-mongodb.exe", "executable_sha256": null }
      }
    }
  ]
}
